{
  "schemaVersion": 1,
  "id": "http-api",
  "name": "HTTP API 通用器",
  "description": "向任意 HTTP API 发起 GET/POST/PUT/DELETE 请求并解析 JSON 响应，是接入内部系统与开放 API 的万能后门。",
  "icon": "🔌",
  "category": "data",
  "tags": ["HTTP", "API", "REST"],
  "offline": true,
  "server": {
    "transport": "stdio",
    "command": "python",
    "args": ["${LOCAL_SERVER}"]
  },
  "inputs": [
    { "key": "LOCAL_SERVER", "title": "内置服务器路径（自动填充，无需修改）", "required": false }
  ],
  "readOnlyTools": ["clipboard_get", "ics_events", "rss_read", "http_request", "email_list", "notify_send"]
}
